{
  "$schema": "https://json-schema.org/draft/2020-12/schema",
  "$id": "https://redline-msp-automation.example/schemas/lever-result.schema.json",
  "$comment": "Generated by tools/gen_schemas.py from core.levers.models.InvokeResult. Do not edit by hand; run the script.",
  "$defs": {
    "Change": {
      "additionalProperties": false,
      "description": "One field-level difference between the tenant state before and after a lever.",
      "properties": {
        "op": {
          "enum": [
            "add",
            "remove",
            "replace"
          ],
          "title": "Op",
          "type": "string"
        },
        "path": {
          "title": "Path",
          "type": "string"
        },
        "before": {
          "default": null,
          "title": "Before"
        },
        "after": {
          "default": null,
          "title": "After"
        }
      },
      "required": [
        "op",
        "path"
      ],
      "title": "Change",
      "type": "object"
    }
  },
  "additionalProperties": false,
  "properties": {
    "status": {
      "enum": [
        "ok",
        "denied",
        "error"
      ],
      "title": "Status",
      "type": "string"
    },
    "reason": {
      "default": "",
      "title": "Reason",
      "type": "string"
    },
    "lever": {
      "title": "Lever",
      "type": "string"
    },
    "client": {
      "title": "Client",
      "type": "string"
    },
    "identity": {
      "title": "Identity",
      "type": "string"
    },
    "mode": {
      "title": "Mode",
      "type": "string"
    },
    "approver": {
      "anyOf": [
        {
          "type": "string"
        },
        {
          "type": "null"
        }
      ],
      "default": null,
      "title": "Approver"
    },
    "data": {
      "default": null,
      "title": "Data"
    },
    "diff": {
      "default": [],
      "items": {
        "$ref": "#/$defs/Change"
      },
      "title": "Diff",
      "type": "array"
    },
    "applied": {
      "default": false,
      "title": "Applied",
      "type": "boolean"
    },
    "audit_seq": {
      "title": "Audit Seq",
      "type": "integer"
    }
  },
  "required": [
    "status",
    "lever",
    "client",
    "identity",
    "mode",
    "audit_seq"
  ],
  "title": "InvokeResult",
  "type": "object"
}
